{
  "financial": [
    "当初予算額",
    "補正予算額",
    "繰越事業費繰越額",
    "予備費支出",
    "流用増減",
    "予算現額計",
    "支出済額",
    "翌年度繰越額",
    "不用額",
    "執行率"
  ],
  "levels": [
    "事業",
    "内訳1",
    "内訳2",
    "内訳3",
    "内訳4"
  ],
  "inner_headers": [
    [
      "種別",
      "数量",
      "金額"
    ],
    [
      "区分",
      "件数",
      "金額"
    ],
    [
      "種別",
      "扶助内容",
      "対象者数等",
      "金額"
    ],
    [
      "種目",
      "件数",
      "金額"
    ],
    [
      "区分",
      "月額",
      "児童数（延）",
      "金額"
    ],
    [
      "種別",
      "接種者数等",
      "金額"
    ],
    [
      "助成基準",
      "施工数",
      "金額"
    ],
    [
      "区分",
      "件数",
      "給付額"
    ]
  ],
  "quantity_exclusion": {
    "kind": "数量表",
    "reason": "数量表は原典の最細区分行を保持する独立した非金額の内訳であり、金額表に入れない。"
  },
  "reserve_exclusion": {
    "kind": "予備費の充用",
    "reason": "予備費の充用先は reserve 表に保持し、明細表の行にしない。"
  },
  "personnel_exclusion": {
    "kind": "職員",
    "reason": "職員人数は給与費の人数内訳であり、明細金額を付与しない。"
  },
  "lending_exclusion": {
    "kind": "貸付金",
    "reason": "貸付状況表は支出内訳とは異なる実績の表であり、明細表の行にしない。"
  },
  "section_exclusion": {
    "kind": "節の一覧",
    "reason": "事業説明のない目は法定節を採用済み。事業説明のある目の法定節一覧は、節の軸の取り込みが未実装のための一時的な除外。次の作業で節の軸として取り込む。"
  }
}
